URL;Full Name;Short Name;Suffix Web;Suffix Excel
https://aulaenlinea.justicia.es:443/course/view.php?id=52726 ;PAQUETES DE INCORPORACION-CGF Fiscalías-BA-104;PAQUETES DE INCORPORACIONCGFFiscaliasBA104;104;104
https://aulaenlinea.justicia.es:443/course/view.php?id=52727 ;PAQUETES DE INCORPORACION-CGF Órganos Judiciales-BA-DON BENITO-116;PAQUETES DE INCORPORACIONCGFOOJJBADON BENITO116;116;116
https://aulaenlinea.justicia.es:443/course/view.php?id=52728 ;PAQUETES DE INCORPORACION-CGF Órganos Colegiados-IB-PALMA-169;PAQUETES DE INCORPORACIONCGFOCIBPALMA169;169;169
https://aulaenlinea.justicia.es:443/course/view.php?id=52729 ;PAQUETES DE INCORPORACION-CGF Órganos Judiciales-GU-SIGUENZA-108;PAQUETES DE INCORPORACIONCGFOOJJGUSIGUENZA108;108;108
https://aulaenlinea.justicia.es:443/course/view.php?id=52730 ;PAQUETES DE INCORPORACION-CGF de Violencia sobre la Mujer-MU-TOTANA-108;PAQUETES DE INCORPORACIONCGFOOJJ VSMMUTOTANA108;108;108
https://aulaenlinea.justicia.es:443/course/view.php?id=52731 ;PAQUETES DE INCORPORACION-CGF Órganos Judiciales-TO-ILLESCAS-126;PAQUETES DE INCORPORACIONCGFOOJJTOILLESCAS126;126;126
https://aulaenlinea.justicia.es:443/course/view.php?id=52732 ;JUSTICIA DIGITAL-CGF Audiencia Nacional (EJE)-M-105;JUSTICIA DIGITALCGFAN (EJE)M105;105;105
https://aulaenlinea.justicia.es:443/course/view.php?id=52733 ;JUSTICIA DIGITAL-Jueces y/o Magistrados Audiencia Nacional-M-117;JUSTICIA DIGITALJMANM117;117;117
